{
  "vct": "eu.we-build:ownership:1",
  "iss": "https://issuer.bosch.com/ownership",
  "iat": 1747044000,
  "exp": 1778580000,
  "nbf": 1747044000,
  "sub": "did:example:target-company-lei-529900T8BM49AURSDO55",
  "issuing_entity": "http://bosch.com/did",
  "attestation_legal_category": "EAA",
  "schema_version": "0.9.0",
  "trust_anchor_url": "https://trust.webuildconsortium.eu/anchors/eidas-tl",

  "cnf": {
    "jwk": {
      "kty": "EC",
      "crv": "P-256",
      "x": "TCAER19Zvu3OHF4j4W4vfSVoHIP1ILilDls7vCeGemc",
      "y": "ZxjiWWbZMQGHVWKVQ4hbSIirsVfuecCE6t4jT9F2HZQ"
    }
  },

  "status": {
    "type": "status-list",
    "status_list_credential": "https://issuer.bosch.com/status/ownership/2025",
    "status_list_index": 789,
    "status_purpose": "revocation"
  },
  "owner": [
    {
      "type": "Person",
      "jurisdiction": "DE",
      "person": {
        "first_name": "Anna",
        "surname": "Schmidt",
        "birth_date": "1978-04-15"
      },
      "address": {
        "street": "Hauptstraße",
        "house_number": "12",
        "locality": "Berlin",
        "region": "Berlin",
        "postal_code": "10115",
        "country": "DE"
      },
      "interests": {
        "type": ["shareholding"],
        "level": "direct",
        "percentage": 51.0,
        "quantity": 51000,
        "class": "ordinary",
        "rights": ["dividend_rights", "liquidation_rights"],
        "description": "Direct majority shareholding acquired at company founding"
      },
      "effective_date": "2018-03-01",
      "evidence": [
        {
          "id": "src-001",
          "type": "officialRegister",
          "url": "https://www.handelsregister.de/docs/example-gesellschafterliste-2024.pdf"
        }
      ]
    },

    {
     "type": "Person",
      "jurisdiction": "DE",
      "person": {
        "first_name": "Klaus",
        "surname": "Müller",
        "birth_date": "1965-11-22"
      },
      "address": {
        "street": "Berliner Allee",
        "house_number": "88",
        "locality": "Hamburg",
        "region": "Hamburg",
        "postal_code": "20095",
        "country": "DE"
      },
      "interests": {
        "type": ["nomineeShareholding", "votingRights"],
        "level": "indirect",
        "percentage": 10.0,
        "quantity": 10000,
        "class": "ordinary",
        "rights": ["dividend_rights"],
        "description": "Indirect holding via nominee arrangement through HoldCo GmbH"
      },
      "effective_date": "2020-07-01",
      "evidence": [
        {
          "id": "src-002",
          "type": "shareholderAgreement",
          "url": "https://example.com/docs/nominee-agreement-2020.pdf"
        }
      ]
    },

    {
      "type": "Entity",
      "jurisdiction": "DE",
      "entity": {
        "category": "legal_entity",
        "name": "Holding GmbH",
        "identifier": {
          "euid": "DE-HRB-654321",
          "lei": "529900T8BM49AURSDO55",
          "tax": "DE987654321"
        },
        "jurisdiction": "DE",
        "form": "private_company"
      },
      "address": {
        "street": "Musterstraße",
        "house_number": "45",
        "locality": "Frankfurt",
        "region": "Hessen",
        "postal_code": "60311",
        "country": "DE"
      },
      "interests": {
        "type": ["shareholding", "votingRights"],
        "level": "indirect",
        "percentage": 30.0,
        "quantity": 30000,
        "class": "preferred",
        "rights": ["dividend_rights"],
        "description": "Holding company controlling 30% preferred shares"
      },
      "effective_date": "2019-06-15",
      "evidence": [
        {
          "id": "src-003",
          "type": "shareholderAgreement",
          "url": "https://example.com/docs/shareholder-agreement-2019.pdf"
        },
        {
          "id": "src-004",
          "type": "articlesOfAssociation",
          "url": "https://example.com/docs/articles-of-association-holdco.pdf"
        }
      ]
    },

    {
      "type": "Entity",
      "jurisdiction": "LU",
      "entity": {
        "category": "legal_arrangement",
        "name": "Schmidt Family Trust",
        "identifier": {
          "lei": "549300ABCDEF12345678"
        },
        "jurisdiction": "LU",
        "form": "trust",
        "subtype_info": {
          "settlement": "Settled under Luxembourg trust law on 2015-03-01 by Anna Schmidt as settlor",
          "purpose": "Family wealth management, succession planning, and asset protection for Schmidt family beneficiaries",
          "assets": "Real estate holdings, securities portfolios, cash deposits, and equity stakes in operating companies",
          "reason_for_registration": "Registered for tax transparency obligations under the OECD Common Reporting Standard (CRS) and EU DAC6"
        }
      },
      "address": {
        "street": "Rue de la Forêt",
        "house_number": "7",
        "locality": "Luxembourg",
        "region": "Luxembourg",
        "postal_code": "L-1234",
        "country": "LU"
      },
      "interests": {
        "type": ["beneficiaryOfLegalArrangement", "economicBeneficiary"],
        "level": "indirect",
        "percentage": 9.0,
        "quantity": 0,
        "rights": ["dividend_rights", "liquidation_rights"],
        "description": "Trust holds economic interests as beneficiary without formal registered shares"
      },
      "effective_date": "2015-03-01",
      "evidence": [
        {
          "id": "src-005",
          "type": "trustDeed",
          "url": "https://example.com/docs/trust-deed-schmidt-2015.pdf"
        },
        {
          "id": "src-006",
          "type": "thirdPartyVerification",
          "data": "eyJub3RhcnkiOiAiTm90YXJpYXQgTHV4ZW1ib3VyZyIsICJkYXRlIjogIjIwMjUtMDEtMTUiLCAidmVyaWZpZWQiOiB0cnVlfQ=="
        }
      ]
    }
  ]
}